{
    "name": "Purple Worm",
    "size": "gargantuan",
    "creature_type": "monstrosity",
    "alignment": "unaligned",
    "ability_scores": {
        "strength": 28,
        "dexterity": 7,
        "constitution": 22,
        "intelligence": 1,
        "wisdom": 8,
        "charisma": 4
    },
    "armor_class": {
        "value": 18,
        "description": "natural armor"
    },
    "hit_points": {
        "maximum": 247,
        "current": 247
    },
    "hit_dice": {
        "count": 15,
        "dice": 20
    },
    "movement": [
        {
            "movement_type": "walk",
            "speed": {
                "distance": 50,
                "unit": "feet"
            }
        },
        {
            "movement_type": "burrow",
            "speed": {
                "distance": 30,
                "unit": "feet"
            }
        }
    ],
    "saving_throws": {
        "constitution": 11,
        "wisdom": 4
    },
    "senses": [
        {
            "type": "blindsight",
            "distance": 30,
            "distance_type": "feet"
        },
        {
            "type": "tremorsense",
            "distance": 60,
            "distance_type": "feet"
        }
    ],
    "passive_perception": 9,
    "features": [
        {
            "name": "Tunneler",
            "description": "The worm can burrow through solid rock at half its burrow speed and leaves a 10-foot-diameter tunnel in its wake."
        }
    ],
    "actions": [
        {
            "name": "Multiattack",
            "description": "The worm makes two attacks: one with its bite and one with its stinger."
        },
        {
            "name": "Bite",
            "description": "Melee Weapon Attack: +9 to hit, reach 10 ft., one target. Hit: 22 (3d8+9) piercing damage. If the target is a Large or smaller creature, it must succeed on a DC 19 Dexterity saving throw or be swallowed by the worm. A swallowed creature is blinded and restrained, it has total cover against attacks and other effects outside the worm, and it takes 21 (6d6) acid damage at the start of each of the worm's turns.\nIf the worm takes 30 damage or more on a single turn from a creature inside it, the worm must succeed on a DC 21 Constitution saving throw at the end of that turn or regurgitate all swallowed creatures, which fall prone in a space within 10 feet of the worm. If the worm dies, a swallowed creature is no longer restrained by it and can escape from the corpse by using 20 feet of movement, exiting prone.\n\nBlinded:\n• A blinded creature can't see and automatically fails any ability check that requires sight.\n\n• Attack rolls against the creature have advantage, and the creature's attack rolls have disadvantage.\n\nProne:\n• A prone creature's only movement option is to crawl, unless it stands up and thereby ends the condition.\n\n• The creature has disadvantage on attack rolls.\n\n• An attack roll against the creature has advantage if the attacker is within 5 feet of the creature. Otherwise, the attack roll has disadvantage.\n\nRestrained:\n• A restrained creature's speed becomes 0, and it can't benefit from any bonus to its speed.\n\n• Attack rolls against the creature have advantage, and the creature's attack rolls have disadvantage.\n\n• The creature has disadvantage on Dexterity saving throws."
        },
        {
            "name": "Tail Stinger",
            "description": "Melee Weapon Attack: +9 to hit, reach 10 ft., one creature. Hit: 19 (3d6+9) piercing damage, and the target must make a DC 19 Constitution saving throw, taking 42 (12d6) poison damage on a failed save, or half as much damage on a successful one."
        }
    ],
    "challenge_rating": 15.0,
    "environments": [
        "desert",
        "underdark"
    ]
}