{
    "name": "Lich",
    "size": "medium",
    "creature_type": "undead",
    "alignment": "any",
    "ability_scores": {
        "strength": 11,
        "dexterity": 16,
        "constitution": 16,
        "intelligence": 20,
        "wisdom": 14,
        "charisma": 16
    },
    "armor_class": {
        "value": 17,
        "description": "natural armor"
    },
    "hit_points": {
        "maximum": 135,
        "current": 135
    },
    "hit_dice": {
        "count": 18,
        "dice": 8
    },
    "movement": [
        {
            "movement_type": "walk",
            "speed": {
                "distance": 30,
                "unit": "feet"
            }
        }
    ],
    "saving_throws": {
        "constitution": 10,
        "intelligence": 12,
        "wisdom": 9
    },
    "skills": {
        "arcana": 18,
        "history": 12,
        "insight": 9,
        "perception": 9
    },
    "damage_resistances": [
        "cold",
        "lightning",
        "necrotic"
    ],
    "damage_immunities": [
        "poison; bludgeoning",
        "piercing",
        "and slashing from nonmagical attacks"
    ],
    "condition_immunities": [
        "charmed",
        "exhaustion",
        "frightened",
        "paralyzed",
        "poisoned"
    ],
    "senses": [
        {
            "type": "truesight",
            "distance": 120,
            "distance_type": "feet"
        }
    ],
    "passive_perception": 19,
    "languages": [
        "Common plus up to five other languages"
    ],
    "features": [
        {
            "name": "Legendary Resistance (3/Day)",
            "description": "If the lich fails a saving throw, it can choose to succeed instead."
        },
        {
            "name": "Rejuvenation",
            "description": "If it has a phylactery, a destroyed lich gains a new body in 1d10 days, regaining all its hit points and becoming active again. The new body appears within 5 feet of the phylactery."
        },
        {
            "name": "Spellcasting",
            "description": "The lich is an 18th-level spellcaster. Its spellcasting ability is Intelligence (spell save DC 20, +12 to hit with spell attacks). The lich has the following wizard spells prepared:\n\nCantrips (at will): mage hand, prestidigitation, ray of frost\n\n• 1st level (4 slots): detect magic, magic missile, shield, thunderwave\n\n• 2nd level (3 slots): detect thoughts, invisibility, Melf's acid arrow, mirror image\n\n• 3rd level (3 slots): animate dead, counterspell, dispel magic, fireball\n\n• 4th level (3 slots): blight, dimension door\n\n• 5th level (3 slots): cloudkill, scrying\n\n• 6th level (1 slot): disintegrate, globe of invulnerability\n\n• 7th level (1 slot): finger of death, plane shift\n\n• 8th level (1 slot): dominate monster, power word stun\n\n• 9th level (1 slot): power word kill"
        },
        {
            "name": "Turn Resistance",
            "description": "The lich has advantage on saving throws against any effect that turns undead."
        }
    ],
    "actions": [
        {
            "name": "Paralyzing Touch",
            "description": "Melee Spell Attack: +12 to hit, reach 5 ft., one creature. Hit: 10 (3d6) cold damage. The target must succeed on a DC 18 Constitution saving throw or be paralyzed for 1 minute. The target can repeat the saving throw at the end of each of its turns, ending the effect on itself on a success.\n\nParalyzed:\n• A paralyzed creature is incapacitated, meaning it can't take actions or reactions, and can't move or speak.\n\n• The creature automatically fails Strength and Dexterity saving throws.\n\n• Attack rolls against the creature have advantage.\n\n• Any attack that hits the creature is a critical hit if the attacker is within 5 feet of the creature."
        }
    ],
    "legendary_actions": [
        {
            "name": "Legendary Actions (3/Turn)",
            "description": "The lich can take 3 legendary actions, choosing from the options below. Only one legendary action option can be used at a time, and only at the end of another creature's turn. The lich regains spent legendary actions at the start of its turn."
        },
        {
            "name": "Cantrip",
            "description": "The lich casts a cantrip."
        },
        {
            "name": "Paralyzing Touch (Costs 2 Actions)",
            "description": "The lich uses its Paralyzing Touch."
        },
        {
            "name": "Frightening Gaze (Costs 2 Actions)",
            "description": "The lich fixes its gaze on one creature it can see within 10 feet of it. The target must succeed on a DC 18 Wisdom saving throw against this magic or become frightened for 1 minute. The frightened target can repeat the saving throw at the end of each of its turns, ending the effect on itself on a success. If a target's saving throw is successful or the effect ends for it, the target is immune to the lich's gaze for the next 24 hours.\n\nFrightened:\n• A frightened creature has disadvantage on ability checks and attack rolls while the source of its fear is within line of sight.\n\n• The creature can't willingly move closer to the source of its fear."
        },
        {
            "name": "Disrupt Life (Costs 3 Actions)",
            "description": "Each living creature within 20 feet of the lich must make a DC 18 Constitution saving throw against this magic, taking 21 (6d6) necrotic damage on a failed save, or half as much damage on a successful one."
        }
    ],
    "challenge_rating": 21.0
}